{
  "schema_version": "1.3",
  "run_id": "p0-b06",
  "iteration": 1,
  "hashes": {
    "layout_sha256": "28a8cd696c38ccba0f10a3306f58ad7753101d521e65dccc4336693a70628d0f",
    "asset_manifest_sha256": "a7bf89dfc83781e9c058cbb5a733aebffaf4997ef75c4a81409b1f3037f15a0c",
    "output_pptx_sha256": "db1f8a056fd592a44150e7e6d0dd0d59011e237aad9f39897fbaf30f0953304a"
  },
  "output_pptx": "p0-b06-editable.pptx",
  "expected_element_count": 12,
  "built_element_count": 12,
  "missing_element_ids": [],
  "unexpected_element_ids": [],
  "build_order": [
    "bg-top-right-orb",
    "bg-bottom-left-orb",
    "card-left",
    "card-right",
    "flow-arrow",
    "title",
    "subtitle",
    "card-left-title",
    "card-left-body",
    "card-right-title",
    "card-right-body",
    "footer"
  ],
  "element_map": [
    {
      "element_id": "bg-top-right-orb",
      "type": "shape",
      "object_names": [
        "ivt:bg-top-right-orb"
      ],
      "object_count": 1
    },
    {
      "element_id": "bg-bottom-left-orb",
      "type": "shape",
      "object_names": [
        "ivt:bg-bottom-left-orb"
      ],
      "object_count": 1
    },
    {
      "element_id": "title",
      "type": "text",
      "object_names": [
        "ivt:title"
      ],
      "object_count": 1
    },
    {
      "element_id": "subtitle",
      "type": "text",
      "object_names": [
        "ivt:subtitle"
      ],
      "object_count": 1
    },
    {
      "element_id": "card-left",
      "type": "shape",
      "object_names": [
        "ivt:card-left"
      ],
      "object_count": 1
    },
    {
      "element_id": "card-right",
      "type": "shape",
      "object_names": [
        "ivt:card-right"
      ],
      "object_count": 1
    },
    {
      "element_id": "flow-arrow",
      "type": "line",
      "object_names": [
        "ivt:flow-arrow"
      ],
      "object_count": 1
    },
    {
      "element_id": "card-left-title",
      "type": "text",
      "object_names": [
        "ivt:card-left-title"
      ],
      "object_count": 1
    },
    {
      "element_id": "card-left-body",
      "type": "text",
      "object_names": [
        "ivt:card-left-body"
      ],
      "object_count": 1
    },
    {
      "element_id": "card-right-title",
      "type": "text",
      "object_names": [
        "ivt:card-right-title"
      ],
      "object_count": 1
    },
    {
      "element_id": "card-right-body",
      "type": "text",
      "object_names": [
        "ivt:card-right-body"
      ],
      "object_count": 1
    },
    {
      "element_id": "footer",
      "type": "text",
      "object_names": [
        "ivt:footer"
      ],
      "object_count": 1
    }
  ],
  "assets": [],
  "typography": {
    "text_element_count": 7,
    "run_count": 7,
    "explicit_run_font_count": 0,
    "inherited_run_font_count": 7,
    "unresolved_font_count": 0,
    "non_default_fit_elements": [
      "title",
      "subtitle",
      "card-left-title",
      "card-left-body",
      "card-right-title",
      "card-right-body",
      "footer"
    ],
    "font_resolutions": [
      {
        "element_id": "title",
        "run_index": 0,
        "font_face": "Microsoft YaHei",
        "font_size_pt": 34,
        "source": "style"
      },
      {
        "element_id": "subtitle",
        "run_index": 0,
        "font_face": "Microsoft YaHei",
        "font_size_pt": 18,
        "source": "style"
      },
      {
        "element_id": "card-left-title",
        "run_index": 0,
        "font_face": "Microsoft YaHei",
        "font_size_pt": 21,
        "source": "style"
      },
      {
        "element_id": "card-left-body",
        "run_index": 0,
        "font_face": "Microsoft YaHei",
        "font_size_pt": 14,
        "source": "style"
      },
      {
        "element_id": "card-right-title",
        "run_index": 0,
        "font_face": "Microsoft YaHei",
        "font_size_pt": 21,
        "source": "style"
      },
      {
        "element_id": "card-right-body",
        "run_index": 0,
        "font_face": "Microsoft YaHei",
        "font_size_pt": 14,
        "source": "style"
      },
      {
        "element_id": "footer",
        "run_index": 0,
        "font_face": "Microsoft YaHei",
        "font_size_pt": 17,
        "source": "style"
      }
    ]
  },
  "connections": [
    {
      "element_id": "flow-arrow",
      "from_id": "card-left",
      "to_id": "card-right"
    }
  ],
  "warnings": []
}
